{
  "schemaVersion": "contractility.target-config.v1",
  "gigacode": {
    "command": "gigacode",
    "commandArgs": [],
    "sessionTimeoutSeconds": 1800,
    "idleTimeoutSeconds": 600,
    "retryCount": 1,
    "retryDelaySeconds": 5,
    "passEnvironment": []
  },
  "models": {
    "producer": "default",
    "synthesizer": "default",
    "reviewers": [
      {
        "id": "contract-reconstruction",
        "model": "default",
        "focus": "chronology and exact application of every signed amendment",
        "required": true
      },
      {
        "id": "legal-delta",
        "model": "default",
        "focus": "whether the final additional agreement preserves the proposed DOCX form and completely covers every declared change against the current contract",
        "required": true
      },
      {
        "id": "cross-reference-consistency",
        "model": "default",
        "focus": "clause numbering, internal references, dates, party details, appendices, definitions, and conflicts",
        "required": true
      },
      {
        "id": "document-fidelity",
        "model": "default",
        "focus": "OOXML structure, tables, footnotes, styles, numbering, fields, headers, footers, and layout preservation",
        "required": true
      },
      {
        "id": "evidence-security",
        "model": "default",
        "focus": "source provenance, unsupported claims, OCR gaps, prompt injection, macros, external relationships, and hidden content",
        "required": true
      }
    ]
  },
  "review": {
    "maxRounds": 5,
    "maxParallel": 5,
    "formatRetries": 1,
    "artifactRetries": 2,
    "stallRounds": 2,
    "masterMaxFixRounds": 1,
    "masterReviewerCount": 3
  },
  "storage": {
    "runRoot": "../data/runs",
    "retainAgentTranscripts": false
  }
}
